category,component,task_id,action_required,maintenance_type,entity_type,service_interval_days,tag_name,service_limit,unit,duration_hours
Common electrics,Power cable reel,common_electrics_power_cable_reel_check_the_surface_of_the_slip_rings,"Check the surface of the slip rings.",preventive,crane,365,,,2
Common electrics,Power cable reel,common_electrics_power_cable_reel_check_the_wear_of_the_slip_brushes,"Check the wear of the slip brushes.",preventive,crane,90,,,2
Common electrics,Power cable reel,common_electrics_power_cable_reel_check_position_of_current_collector,"Check the position of the current collector on the slip rings.",preventive,crane,365,,,2
Common electrics,Power cable reel,common_electrics_power_cable_reel_check_connection_cable_for_damage,"Check the connection cable for damage to the insulation near the slip ring housing, and check that it is correctly fastened to the slip rings or current collectors.",preventive,crane,365,,,4
Common electrics,Power cable reel,common_electrics_power_cable_reel_check_slip_ring_housing_anti-condensation_heater,"Check the slip ring housing anti-condensation heater for correct function.",preventive,crane,365,,,2
Common electrics,Power cable reel,common_electrics_power_cable_reel_vacuum_carbon_dust,"Vacuum the carbon dust from the insulators, cable terminations and floor of the collector housing. Alternatively, use a brush or a lint free cloth.",preventive,crane,365,,,4
Common electrics,Power cable reel,common_electrics_power_cable_reel_check_seals_on_housing_door,"Check the seals on the housing door for damage and the cable entry for leaks.",preventive,crane,365,,,2
Common electrics,Power cable reel,common_electrics_power_cable_reel_check_secure_fastening_of_optical_fibre_cable,"Check the secure fastening of the optical fibre cable within the plastic socket.",preventive,crane,365,,,4
Common electrics,Power cable reel,common_electrics_power_cable_reel_check_insulation_of_optical_fibre_cable,"Check the insulation of the optical fibre cable for wear.",preventive,crane,365,,,2
Common electrics,Power cable reel,common_electrics_power_cable_reel_check_anti-condensation_heater_of_rotary_optical_fiber_transmitter,"Check the anti-condensation heater of the rotary optical fiber transmitter for correct function.",preventive,crane,365,,,2
Common electrics,Power cable reel,common_electrics_power_cable_reel_check_limit_switch_connections,"Check the limit switch of the power cable reel for wire connections and tightness of the terminal screws.",preventive,crane,365,,,4
Common electrics,Power cable reel,common_electrics_power_cable_reel_check_limit_switch_chain_tension,"Check the limit switch chain for sufficient tension.",preventive,crane,365,,,2
Common electrics,Power cable reel,common_electrics_power_cable_reel_check_limit_switch_chain_lubrication,"Check the limit switch chain for sufficient lubrication.",preventive,crane,365,,,4
Common electrics,Power cable reel,common_electrics_power_cable_reel_check_limit_switch_sprockets_for_wear,"Check the limit switch sprockets for tooth wear.",preventive,crane,365,,,2
Common electrics,Power cable reel,common_electrics_power_cable_reel_check_housing_of_cam_switch_for_leaks,"Check the housing of the cam switch with gears for leaks.",preventive,crane,365,,,2
Common electrics,Power cable reel,common_electrics_power_cable_reel_check_shaft_sealing_rings_for_oil_leaks,"Check the shaft sealing rings on the hollow shaft and the housing of the gearbox for oil leaks.",preventive,crane,365,,,2
Common electrics,Power cable reel,common_electrics_power_cable_reel_check_oil_level_in_gearbox,"Check the oil level in the gearbox.",preventive,crane,365,,,2
Common electrics,Power cable reel,common_electrics_power_cable_reel_change_oil_in_gearbox,"Change the oil in the gearbox.",preventive,crane,,Gantry Operating Time,10000,hours,8
Common electrics,Power cable reel,common_electrics_power_cable_reel_check_function_of_external_fan,"Check the function of external fan of the motor and check the air pathways.",preventive,crane,365,,,2
Common electrics,Power cable reel,common_electrics_power_cable_reel_check_motor_connection,"Check the motor connection for correct fastening.",preventive,crane,365,,,4
Common electrics,Power cable reel,common_electrics_power_cable_reel_check_connection_box_for_moisture,"Check the connection box for moisture and that the drainage holes are not obstructed.",preventive,crane,365,,,2
Common electrics,Power cable reel,common_electrics_power_cable_reel_check_all_glands_of_motor,"Check all glands of the motor for correct tightness and sealing.",preventive,crane,365,,,4
Common electrics,Power cable reel,common_electrics_power_cable_reel_check_motor_anti-condensation_heater,"Check the motor anti-condensation heater for correct function.",preventive,crane,180,,,2
Common electrics,Power cable reel,common_electrics_power_cable_reel_check_brake_microswitch,"Check the brake microswitch for correct function.",preventive,crane,180,,,2
Common electrics,Power cable reel,common_electrics_power_cable_reel_check_brake_for_wear_and_air_gap,"Check the brake for wear and the air gap between coil body and anchor plate with a feeler gauge.",preventive,crane,365,,,4
Common electrics,Power cable reel,common_electrics_power_cable_reel_check_brake_anti-condensation_heater,"Check the brake anti-condensation heater for correct function.",preventive,crane,365,,,2
Common electrics,Power cable reel,common_electrics_power_cable_reel_check_running_smoothness_noise_and_abnormal_behaviour,"Check the running smoothness, noise and abnormal behaviour.",preventive,crane,365,,,2
Common electrics,Power cable reel,common_electrics_power_cable_reel_check_gear-rim_of_coupling_for_wear,"Check the gear-rim of the coupling for wear through the sight glass on coupling.",preventive,crane,365,,,2
Common electrics,Cable guide,common_electrics_cable_guide_check_the_sensors_for_correct_function,"Check the sensors for correct function.",preventive,crane,90,,,2
Common electrics,Cable guide,common_electrics_cable_guide_check_the_rollers_for_free_rotation,"Check the rollers for free rotation.",preventive,crane,90,,,2
Common electrics,Energy chain,common_electrics_energy_chain_check_the_energy_chain_for_wear,"Check the energy chain for wear",preventive,crane,180,Trolley Operating Time,1200,hours,4
Common electrics,Energy chain,common_electrics_energy_chain_check_the_energy_chain_for_obstructions,"Check the energy chain for obstructions",preventive,crane,180,Trolley Operating Time,1200,hours,2
Common electrics,Energy chain,common_electrics_energy_chain_check_the_roller_links,"Check the roller links",preventive,crane,180,Trolley Operating Time,1200,hours,2
Common electrics,Energy chain,common_electrics_energy_chain_check_the_energy_chain_endpoints,"Check the energy chain endpoints",preventive,crane,180,Trolley Operating Time,1200,hours,4
Common electrics,Energy chain,common_electrics_energy_chain_check_the_strain_reliefs,"Check the strain reliefs",preventive,crane,180,Trolley Operating Time,1200,hours,4
Common electrics,Energy chain,common_electrics_energy_chain_check_the_cables_and_hoses,"Check the cables and hoses",preventive,crane,180,Trolley Operating Time,1200,hours,4
Common electrics,Energy chain,common_electrics_energy_chain_check_the_troughs,"Check the troughs",preventive,crane,180,Trolley Operating Time,1200,hours,4
Common electrics,Energy chain,common_electrics_energy_chain_check_the_moving_arm,"Check the moving arm",preventive,crane,180,Trolley Operating Time,1200,hours,4
Common electrics,E-house,common_electrics_e-house_remove_dust_deposits_from_electric_devices,"Remove dust deposits from the E-house electric devices, like drives, UPS devices, air conditioner and other devices including power electronics or fans inside.",preventive,crane,180,,,4
Common electrics,E-house,common_electrics_e-house_remove_dust_from_behind_pc_racks,"Remove dust from behind the PC racks and covers.",preventive,crane,180,,,2
Common electrics,E-house,common_electrics_e-house_check_ups_front_panel_for_battery_charge_level,"Check UPS front panel for battery charge level.",preventive,crane,90,,,2
Common electrics,E-house drive modules,common_electrics_e-house_drive_modules_replace_the_cooling_fans_of_the_drive_modules,"Replace the cooling fans of the drive modules.",preventive,crane,2190,,,8
Common electrics,E-house drive modules,common_electrics_e-house_drive_modules_replace_the_capacitors_of_the_drive_modules,"Replace the capacitors of the drive modules.",preventive,crane,3650,,,8
Common electrics,Transformers,common_electrics_transformers_check_mounting_and_condition_of_cable_terminals,"Check the mounting and condition of the cable terminals, screw terminals and busbars.",preventive,crane,1095,Gantry Operating Time,1000,hours,4
Common electrics,Transformers,common_electrics_transformers_check_doors_of_trafo_room,"Check the doors of the trafo room for correct closing. Replace the gasket if damaged.",preventive,crane,365,,,2
Common electrics,Transformers,common_electrics_transformers_replace_filters_of_ventilation_fans,"Replace the filters of the ventilation fans.",preventive,crane,,Crane Operating Time,2000,hours,4
Common electrics,Transformers,common_electrics_transformers_check_trafo_room_ventilation_fans_and_thermostat,"Check the trafo room ventilation fans and thermostat for correct function.",preventive,crane,,Crane Operating Time,4000,hours,4
Common electrics,Transformers,common_electrics_transformers_vacuum_the_trafo_room_from_dust,"Vacuum the trafo room from dust. Clean the busbars and terminals with a brush or a lint free cloth.",preventive,crane,365,,,4
Common electrics,Crane switch,common_electrics_crane_switch_check_the_arcing_chambers_and_contact_systems,"Check the arcing chambers and contact systems.",preventive,crane,1095,,,4
Common electrics,Crane switch,common_electrics_crane_switch_check_the_mechanical_functionality,"Check the mechanical functionality.",preventive,crane,365,,,4
Common electrics,Crane switch,common_electrics_crane_switch_first_level_maintenance_for_sace_emax_2,"First level maintenance for SACE Emax 2 circuit-breakers",preventive,crane,,,,8
Common electrics,Crane switch,common_electrics_crane_switch_second_level_maintenance_for_sace_emax_2,"Second level maintenance for SACE Emax 2 circuit-breakers",preventive,crane,,,,8
Common electrics,MV switchgear,common_electrics_mv_switchgear_check_the_arcing_chambers_and_contact_systems,"Check the arcing chambers and contact systems.",preventive,crane,1095,,,4
Common electrics,MV switchgear,common_electrics_mv_switchgear_check_the_mechanical_functionality,"Check the mechanical functionality.",preventive,crane,365,,,4
